{
  "id": "blade-open-vein",
  "classId": "blade",
  "school": "bloodletter",
  "tier": 1,
  "name": "Open Vein",
  "description": "1.0× Slash to a front-row enemy; Bleed 3 turns.",
  "type": "active",
  "cost": 10,
  "weight": 1000,
  "target": "enemyFront",
  "effects": [
    {
      "kind": "damage",
      "multiplier": 1,
      "damageType": "slash",
      "scalesWith": "strength"
    },
    {
      "kind": "applyStatus",
      "status": "bleed",
      "duration": 3
    }
  ],
  "prerequisiteId": null,
  "isUltimate": false,
  "monsterTechniqueOf": null,
  "rankScaling": {
    "effectPerRank": 4,
    "costPerRank": -2
  },
  "mastery": {
    "text": "Bleed 4 turns.",
    "effects": [
      {
        "kind": "applyStatus",
        "status": "bleed",
        "duration": 4
      }
    ]
  },
  "tags": [
    "singleTarget",
    "dot"
  ],
  "xpTags": [
    "strength",
    "agility"
  ],
  "aiHints": {
    "role": "attack",
    "priority": 60
  }
}
