{
  "id": "mender-soothing-word",
  "classId": "mender",
  "school": "benediction",
  "tier": 1,
  "name": "Soothing Word",
  "description": "One ally gains Regen for 3 turns (5% of max HP per turn).",
  "type": "active",
  "cost": 12,
  "weight": 1000,
  "target": "ally",
  "effects": [
    {
      "kind": "applyStatus",
      "status": "regen",
      "duration": 3,
      "percent": 5,
      "note": "the Tier I Regen magnitude (03 §3.5)"
    }
  ],
  "prerequisiteId": null,
  "isUltimate": false,
  "monsterTechniqueOf": null,
  "rankScaling": {
    "effectPerRank": 4,
    "costPerRank": -2
  },
  "mastery": {
    "text": "Regen 4 turns.",
    "effects": [
      {
        "kind": "applyStatus",
        "status": "regen",
        "duration": 4,
        "percent": 5
      }
    ]
  },
  "tags": [
    "singleTarget",
    "heal"
  ],
  "xpTags": [
    "wisdom"
  ],
  "aiHints": {
    "role": "heal",
    "priority": 50
  }
}
