{
  "id": "ranger-ambush-sense",
  "classId": "ranger",
  "school": "pathfinder",
  "tier": 3,
  "name": "Ambush Sense",
  "description": "Party ambush chance −10%; when the party surprises the monsters, every ally +10 Momentum.",
  "type": "passive",
  "cost": 0,
  "weight": null,
  "target": "self",
  "effects": [
    {
      "kind": "custom",
      "customId": "party-ambush-modifier",
      "amount": -10,
      "target": "allAllies",
      "note": "the party’s ambush roll shifted by amount percentage points, as a pet trait does"
    },
    {
      "kind": "custom",
      "customId": "momentum-on-surprise",
      "amount": 10,
      "target": "allAllies",
      "note": "when the party surprises the monsters, every ally gains amount Momentum"
    }
  ],
  "prerequisiteId": "ranger-double-time",
  "isUltimate": false,
  "monsterTechniqueOf": null,
  "rankScaling": {
    "effectPerRank": 4,
    "costPerRank": -2
  },
  "mastery": {
    "text": "−15% / +20 Momentum.",
    "effects": [
      {
        "kind": "custom",
        "customId": "party-ambush-modifier",
        "amount": -15,
        "target": "allAllies"
      },
      {
        "kind": "custom",
        "customId": "momentum-on-surprise",
        "amount": 20,
        "target": "allAllies"
      }
    ]
  },
  "tags": [
    "scouting",
    "momentum"
  ],
  "xpTags": [
    "perception"
  ],
  "aiHints": {
    "role": "utility",
    "priority": 0
  }
}
